======================================================================
ARC SOLVER - 200 TASK EVALUATION
======================================================================
Loading tasks from synthetic_evaluation_200.json...
✓ Loaded 200 synthetic tasks
======================================================================
RUNNING 200-TASK EVALUATION
======================================================================

Total tasks: 200
Max time per task: 15.0s
Estimated total time: 50.0 minutes
[  1/200] identity_0                     ✓ (100.0%) [ 0.04s]
[  2/200] identity_1                     ✓ (100.0%) [ 0.03s]
[  3/200] identity_2                     ✓ (100.0%) [ 0.04s]
[  4/200] identity_3                     ✓ (100.0%) [ 0.04s]
[  5/200] identity_4                     ✓ (100.0%) [ 0.03s]
[  6/200] identity_5                     ✓ (100.0%) [ 0.03s]
[  7/200] identity_6                     ✓ (100.0%) [ 0.02s]
[  8/200] identity_7                     ✓ (100.0%) [ 0.02s]
[  9/200] identity_8                     ✓ (100.0%) [ 0.02s]
[ 10/200] identity_9                     ✓ (100.0%) [ 0.03s]
[ 11/200] identity_10                    ✓ (100.0%) [ 0.04s]
[ 12/200] identity_11                    ✓ (100.0%) [ 0.03s]
[ 13/200] identity_12                    ✓ (100.0%) [ 0.04s]
[ 14/200] identity_13                    ✓ (100.0%) [ 0.02s]
[ 15/200] identity_14                    ✓ (100.0%) [ 0.01s]
[ 16/200] identity_15                    ✓ (100.0%) [ 0.03s]
[ 17/200] identity_16                    ✓ (100.0%) [ 0.04s]
[ 18/200] flip_h_17                      ✓ (100.0%) [ 0.03s]
[ 19/200] flip_h_18                      ✓ (100.0%) [ 0.02s]
[ 20/200] flip_h_19                      ✓ (100.0%) [ 0.04s]
  Progress: 20/200 | Success rate: 100.0% | Avg time: 0.03s | ETA: 0.1m
[ 21/200] flip_h_20                      ✗ (66.7%) [ 0.01s]
[ 22/200] flip_h_21                      ✓ (100.0%) [ 0.02s]
[ 23/200] flip_h_22                      ✓ (100.0%) [ 0.01s]
[ 24/200] flip_h_23                      ✓ (100.0%) [ 0.03s]
[ 25/200] flip_h_24                      ✓ (100.0%) [ 0.04s]
[ 26/200] flip_h_25                      ✓ (100.0%) [ 0.02s]
[ 27/200] flip_h_26                      ✓ (100.0%) [ 0.02s]
[ 28/200] flip_h_27                      ✓ (100.0%) [ 0.02s]
[ 29/200] flip_h_28                      ✓ (100.0%) [ 0.01s]
[ 30/200] flip_h_29                      ✓ (100.0%) [ 0.02s]
[ 31/200] flip_h_30                      ✓ (100.0%) [ 0.02s]
[ 32/200] flip_h_31                      ✓ (100.0%) [ 0.04s]
[ 33/200] flip_h_32                      ✓ (100.0%) [ 0.02s]
[ 34/200] flip_h_33                      ✓ (100.0%) [ 0.03s]
[ 35/200] flip_v_34                      ✓ (100.0%) [ 0.03s]
[ 36/200] flip_v_35                      ✓ (100.0%) [ 0.01s]
[ 37/200] flip_v_36                      ✗ (55.6%) [ 0.01s]
[ 38/200] flip_v_37                      ✓ (100.0%) [ 0.02s]
[ 39/200] flip_v_38                      ✓ (100.0%) [ 0.03s]
[ 40/200] flip_v_39                      ✓ (100.0%) [ 0.03s]
  Progress: 40/200 | Success rate: 95.0% | Avg time: 0.03s | ETA: 0.1m
[ 41/200] flip_v_40                      ✓ (100.0%) [ 0.03s]
[ 42/200] flip_v_41                      ✓ (100.0%) [ 0.02s]
[ 43/200] flip_v_42                      ✓ (100.0%) [ 0.01s]
[ 44/200] flip_v_43                      ✓ (100.0%) [ 0.02s]
[ 45/200] flip_v_44                      ✓ (100.0%) [ 0.02s]
[ 46/200] flip_v_45                      ✓ (100.0%) [ 0.02s]
[ 47/200] flip_v_46                      ✓ (100.0%) [ 0.02s]
[ 48/200] flip_v_47                      ✓ (100.0%) [ 0.03s]
[ 49/200] flip_v_48                      ✓ (100.0%) [ 0.02s]
[ 50/200] flip_v_49                      ✓ (100.0%) [ 0.02s]
[ 51/200] flip_v_50                      ✓ (100.0%) [ 0.02s]
[ 52/200] rotate_90_51                   ✓ (100.0%) [ 0.02s]
[ 53/200] rotate_90_52                   ✓ (100.0%) [ 0.02s]
[ 54/200] rotate_90_53                   ✓ (100.0%) [ 0.02s]
[ 55/200] rotate_90_54                   ✓ (100.0%) [ 0.03s]
[ 56/200] rotate_90_55                   ✓ (100.0%) [ 0.02s]
[ 57/200] rotate_90_56                   ✓ (100.0%) [ 0.02s]
[ 58/200] rotate_90_57                   ✓ (100.0%) [ 0.01s]
[ 59/200] rotate_90_58                   ✓ (100.0%) [ 0.03s]
[ 60/200] rotate_90_59                   ✓ (100.0%) [ 0.03s]
  Progress: 60/200 | Success rate: 96.7% | Avg time: 0.02s | ETA: 0.1m
[ 61/200] rotate_90_60                   ✓ (100.0%) [ 0.02s]
[ 62/200] rotate_90_61                   ✓ (100.0%) [ 0.02s]
[ 63/200] rotate_90_62                   ✓ (100.0%) [ 0.02s]
[ 64/200] rotate_90_63                   ✓ (100.0%) [ 0.02s]
[ 65/200] rotate_90_64                   ✓ (100.0%) [ 0.02s]
[ 66/200] rotate_90_65                   ✓ (100.0%) [ 0.02s]
[ 67/200] rotate_90_66                   ✓ (100.0%) [ 0.03s]
[ 68/200] rotate_90_67                   ✓ (100.0%) [ 0.02s]
[ 69/200] rotate_180_68                  ✓ (100.0%) [ 0.03s]
[ 70/200] rotate_180_69                  ✓ (100.0%) [ 0.02s]
[ 71/200] rotate_180_70                  ✓ (100.0%) [ 0.01s]
[ 72/200] rotate_180_71                  ✓ (100.0%) [ 0.02s]
[ 73/200] rotate_180_72                  ✓ (100.0%) [ 0.02s]
[ 74/200] rotate_180_73                  ✓ (100.0%) [ 0.03s]
[ 75/200] rotate_180_74                  ✓ (100.0%) [ 0.02s]
[ 76/200] rotate_180_75                  ✓ (100.0%) [ 0.02s]
[ 77/200] rotate_180_76                  ✓ (100.0%) [ 0.01s]
[ 78/200] rotate_180_77                  ✓ (100.0%) [ 0.01s]
[ 79/200] rotate_180_78                  ✓ (100.0%) [ 0.01s]
[ 80/200] rotate_180_79                  ✓ (100.0%) [ 0.03s]
  Progress: 80/200 | Success rate: 97.5% | Avg time: 0.02s | ETA: 0.0m
[ 81/200] rotate_180_80                  ✓ (100.0%) [ 0.02s]
[ 82/200] rotate_180_81                  ✓ (100.0%) [ 0.02s]
[ 83/200] rotate_180_82                  ✓ (100.0%) [ 0.03s]
[ 84/200] rotate_180_83                  ✓ (100.0%) [ 0.01s]
[ 85/200] rotate_180_84                  ✓ (100.0%) [ 0.02s]
[ 86/200] rotate_270_85                  ✓ (100.0%) [ 0.02s]
[ 87/200] rotate_270_86                  ✓ (100.0%) [ 0.02s]
[ 88/200] rotate_270_87                  ✓ (100.0%) [ 0.03s]
[ 89/200] rotate_270_88                  ✓ (100.0%) [ 0.02s]
[ 90/200] rotate_270_89                  ✓ (100.0%) [ 0.03s]
[ 91/200] rotate_270_90                  ✓ (100.0%) [ 0.01s]
[ 92/200] rotate_270_91                  ✓ (100.0%) [ 0.02s]
[ 93/200] rotate_270_92                  ✓ (100.0%) [ 0.02s]
[ 94/200] rotate_270_93                  ✓ (100.0%) [ 0.02s]
[ 95/200] rotate_270_94                  ✓ (100.0%) [ 0.03s]
[ 96/200] rotate_270_95                  ✓ (100.0%) [ 0.01s]
[ 97/200] rotate_270_96                  ✓ (100.0%) [ 0.02s]
[ 98/200] rotate_270_97                  ✓ (100.0%) [ 0.02s]
[ 99/200] rotate_270_98                  ✓ (100.0%) [ 0.02s]
[100/200] rotate_270_99                  ✓ (100.0%) [ 0.01s]
  Progress: 100/200 | Success rate: 98.0% | Avg time: 0.02s | ETA: 0.0m
[101/200] rotate_270_100                 ✓ (100.0%) [ 0.02s]
[102/200] rotate_270_101                 ✓ (100.0%) [ 0.03s]
[103/200] increment_color_102            ✓ (100.0%) [ 0.03s]
[104/200] increment_color_103            ✓ (100.0%) [ 0.03s]
[105/200] increment_color_104            ✗ (66.7%) [ 0.02s]
[106/200] increment_color_105            ✓ (100.0%) [ 0.01s]
[107/200] increment_color_106            ✗ (44.4%) [ 0.01s]
[108/200] increment_color_107            ✓ (100.0%) [ 0.02s]
[109/200] increment_color_108            ✓ (100.0%) [ 0.04s]
[110/200] increment_color_109            ✓ (100.0%) [ 0.03s]
[111/200] increment_color_110            ✓ (100.0%) [ 0.02s]
[112/200] increment_color_111            ✗ (83.3%) [ 0.02s]
[113/200] increment_color_112            ✗ (75.0%) [ 0.02s]
[114/200] increment_color_113            ✓ (100.0%) [ 0.02s]
[115/200] increment_color_114            ✓ (100.0%) [ 0.03s]
[116/200] increment_color_115            ✓ (100.0%) [ 0.02s]
[117/200] increment_color_116            ✓ (100.0%) [ 0.03s]
[118/200] increment_color_117            ✓ (100.0%) [ 0.04s]
[119/200] increment_color_118            ✗ (83.3%) [ 0.01s]
[120/200] replace_color_119              ✓ (100.0%) [ 0.02s]
  Progress: 120/200 | Success rate: 94.2% | Avg time: 0.02s | ETA: 0.0m
[121/200] replace_color_120              ✗ (33.3%) [ 0.02s]
[122/200] replace_color_121              ✓ (100.0%) [ 0.02s]
[123/200] replace_color_122              ✗ (84.0%) [ 0.05s]
[124/200] replace_color_123              ✓ (100.0%) [ 0.02s]
[125/200] replace_color_124              ✗ (80.0%) [ 0.03s]
[126/200] replace_color_125              ✓ (100.0%) [ 0.02s]
[127/200] replace_color_126              ✓ (100.0%) [ 0.02s]
[128/200] replace_color_127              ✗ (77.8%) [ 0.02s]
[129/200] replace_color_128              ✗ (31.2%) [ 0.03s]
[130/200] replace_color_129              ✗ (76.0%) [ 0.04s]
[131/200] replace_color_130              ✗ (83.3%) [ 0.03s]
[132/200] replace_color_131              ✗ (90.0%) [ 0.03s]
[133/200] replace_color_132              ✗ (83.3%) [ 0.02s]
[134/200] replace_color_133              ✓ (100.0%) [ 0.02s]
[135/200] replace_color_134              ✗ (44.4%) [ 0.03s]
[136/200] replace_color_135              ✗ (93.8%) [ 0.03s]
[137/200] tile_horizontal_136            ✓ (100.0%) [ 0.02s]
[138/200] tile_horizontal_137            ✓ (100.0%) [ 0.02s]
[139/200] tile_horizontal_138            ✓ (100.0%) [ 0.03s]
[140/200] tile_horizontal_139            ✓ (100.0%) [ 0.02s]
  Progress: 140/200 | Success rate: 87.1% | Avg time: 0.02s | ETA: 0.0m
[141/200] tile_horizontal_140            ✓ (100.0%) [ 0.01s]
[142/200] tile_horizontal_141            ✓ (100.0%) [ 0.01s]
[143/200] tile_horizontal_142            ✓ (100.0%) [ 0.02s]
[144/200] tile_horizontal_143            ✓ (100.0%) [ 0.03s]
[145/200] tile_horizontal_144            ✓ (100.0%) [ 0.02s]
[146/200] tile_horizontal_145            ✓ (100.0%) [ 0.02s]
[147/200] tile_horizontal_146            ✓ (100.0%) [ 0.01s]
[148/200] tile_horizontal_147            ✓ (100.0%) [ 0.01s]
[149/200] tile_horizontal_148            ✓ (100.0%) [ 0.02s]
[150/200] tile_horizontal_149            ✓ (100.0%) [ 0.02s]
[151/200] tile_horizontal_150            ✓ (100.0%) [ 0.02s]
[152/200] tile_horizontal_151            ✓ (100.0%) [ 0.02s]
[153/200] tile_horizontal_152            ✓ (100.0%) [ 0.02s]
[154/200] tile_vertical_153              ✓ (100.0%) [ 0.02s]
[155/200] tile_vertical_154              ✓ (100.0%) [ 0.01s]
[156/200] tile_vertical_155              ✓ (100.0%) [ 0.02s]
[157/200] tile_vertical_156              ✓ (100.0%) [ 0.02s]
[158/200] tile_vertical_157              ✓ (100.0%) [ 0.03s]
[159/200] tile_vertical_158              ✓ (100.0%) [ 0.02s]
[160/200] tile_vertical_159              ✓ (100.0%) [ 0.02s]
  Progress: 160/200 | Success rate: 88.8% | Avg time: 0.02s | ETA: 0.0m
[161/200] tile_vertical_160              ✓ (100.0%) [ 0.01s]
[162/200] tile_vertical_161              ✓ (100.0%) [ 0.02s]
[163/200] tile_vertical_162              ✓ (100.0%) [ 0.01s]
[164/200] tile_vertical_163              ✓ (100.0%) [ 0.02s]
[165/200] tile_vertical_164              ✓ (100.0%) [ 0.03s]
[166/200] tile_vertical_165              ✓ (100.0%) [ 0.02s]
[167/200] tile_vertical_166              ✓ (100.0%) [ 0.03s]
[168/200] tile_vertical_167              ✓ (100.0%) [ 0.01s]
[169/200] tile_vertical_168              ✓ (100.0%) [ 0.02s]
[170/200] tile_vertical_169              ✓ (100.0%) [ 0.02s]
[171/200] double_size_170                ✗ ( 0.0%) [ 0.02s]
[172/200] double_size_171                ✗ ( 0.0%) [ 0.03s]
[173/200] double_size_172                ✗ ( 0.0%) [ 0.02s]
[174/200] double_size_173                ✗ ( 0.0%) [ 0.03s]
[175/200] double_size_174                ✗ ( 0.0%) [ 0.02s]
[176/200] double_size_175                ✗ ( 0.0%) [ 0.01s]
[177/200] double_size_176                ✗ ( 0.0%) [ 0.02s]
[178/200] double_size_177                ✗ ( 0.0%) [ 0.02s]
[179/200] double_size_178                ✗ ( 0.0%) [ 0.04s]
[180/200] double_size_179                ✗ ( 0.0%) [ 0.03s]
  Progress: 180/200 | Success rate: 84.4% | Avg time: 0.02s | ETA: 0.0m
[181/200] double_size_180                ✗ ( 0.0%) [ 0.02s]
[182/200] double_size_181                ✗ ( 0.0%) [ 0.02s]
[183/200] double_size_182                ✗ ( 0.0%) [ 0.01s]
[184/200] double_size_183                ✗ ( 0.0%) [ 0.01s]
[185/200] double_size_184                ✗ ( 0.0%) [ 0.03s]
[186/200] double_size_185                ✗ ( 0.0%) [ 0.02s]
[187/200] double_size_186                ✗ ( 0.0%) [ 0.02s]
[188/200] half_size_187                  ✗ ( 0.0%) [ 0.02s]
[189/200] half_size_188                  ✗ ( 0.0%) [ 0.02s]
[190/200] half_size_189                  ✗ ( 0.0%) [ 0.01s]
[191/200] half_size_190                  ✗ ( 0.0%) [ 0.01s]
[192/200] half_size_191                  ✗ ( 0.0%) [ 0.02s]
[193/200] half_size_192                  ✗ ( 0.0%) [ 0.03s]
[194/200] half_size_193                  ✗ ( 0.0%) [ 0.03s]
[195/200] half_size_194                  ✗ ( 0.0%) [ 0.05s]
[196/200] half_size_195                  ✗ ( 0.0%) [ 0.01s]
[197/200] half_size_196                  ✗ ( 0.0%) [ 0.01s]
[198/200] half_size_197                  ✗ ( 0.0%) [ 0.01s]
[199/200] half_size_198                  ✗ ( 0.0%) [ 0.03s]
[200/200] half_size_199                  ✗ ( 0.0%) [ 0.04s]
  Progress: 200/200 | Success rate: 76.0% | Avg time: 0.02s | ETA: 0.0m

======================================================================
EVALUATION RESULTS
======================================================================

### OVERALL PERFORMANCE ###
  Total tasks:      200
  Successful:       152 (76.0%)
  Average accuracy: 82.3%
  Median accuracy:  100.0%

### TIMING ###
  Total time:       0.1 minutes
  Average per task: 0.02s
  Median per task:  0.02s

### PERFORMANCE BY CATEGORY ###
Category             Success Rate    Tasks      Avg Accuracy
----------------------------------------------------------------------
identity             100.0%          17/17       100.0%
rotate               100.0%          51/51       100.0%
tile                 100.0%          34/34       100.0%
flip                 94.1%           32/34       97.7%
increment            70.6%           12/17       91.3%
replace              35.3%           6/17       81.0%
double               0.0%            0/17       0.0%
half                 0.0%            0/13       0.0%

### ACCURACY DISTRIBUTION ###
Range           Count      Percentage
----------------------------------------
0%-20%          30         15.0% ████
20%-40%         2          1.0% 
40%-60%         3          1.5% 
60%-80%         5          2.5% 
80%-95%         8          4.0% █
95%-100%        152        76.0% ██████████████████████

### FAILURE ANALYSIS ###
Total failures: 48
  Near misses (≥70% acc):  11 (22.9%)
  Partial success (30-70%): 7 (14.6%)
  Total failures (<30%):   30 (62.5%)

  Example near misses:
    - increment_color_111            (83.3%) [increment]
    - increment_color_112            (75.0%) [increment]
    - increment_color_118            (83.3%) [increment]
    - replace_color_122              (84.0%) [replace]
    - replace_color_124              (80.0%) [replace]

### TOP SUCCESSES ###
  Fastest solutions:
    - rotate_180_70                  0.008s
    - tile_horizontal_147            0.011s
    - flip_h_28                      0.011s
    - tile_vertical_154              0.011s
    - rotate_270_90                  0.012s

✓ Detailed report saved to evaluation_200_report.json

======================================================================
✓ EVALUATION COMPLETE
======================================================================
