======================================================================
NEAR-MISS ANALYSIS
======================================================================

Goal: Understand what prevents 70-95% accurate solutions from succeeding

Found 10 tasks with 90-99% accuracy

Top 10 near-misses:
   1. fd096ab6     97.0%  identity → color_remap → color_remap
   2. 14754a24     95.8%  identity → erode → erode
   3. 42918530     95.5%  identity → color_remap → color_remap
   4. 575b1a71     95.0%  fill_enclosed → color_remap → connect_objects
   5. e681b708     94.8%  identity → color_remap → color_remap
   6. 42a15761     94.3%  reflection → color_remap → color_remap
   7. 5af49b42     94.1%  erode → erode → erode
   8. 5ffb2104     94.0%  gravity → color_remap → color_remap
   9. 1e97544e     93.2%  dilate → color_remap → color_remap
  10. 79369cc6     92.5%  identity → color_remap → color_remap


######################################################################
# TASK 1/5
######################################################################

======================================================================
ANALYZING TASK: fd096ab6
======================================================================

Task ID: fd096ab6
Training examples: 2
Test examples: 1

--- TRAINING EXAMPLES ---

Training 1:

Input:
  Shape: 22×22
  ██████████████████████
  ██████████████████████
  ██████████████████████
  ████████░░████████████
  ██████░░██████████████
  ████████░█████████████
  ██████████████████████
  ███████████████▀██████
  ██████████████████████
  ███████████████▀██████
  ██████████████████████
  ███▐██████████████████
  ████▐█████████████████
  ██████████████████████
  ████████████████▓▓████
  ███████████████▓██████
  █████████▒████████████
  ████████▒█████████████
  ██████████████████████
  ██████████████████████
  ██████████████████████
  ██████████████████████

Output:
  Shape: 22×22
  ██████████████████████
  ██████████████████████
  ██████████████████████
  ████████░░████████████
  ██████░░██████████████
  ████████░█████████████
  ██████████████████████
  ███████████████▀▀█████
  █████████████▀▀███████
  ███████████████▀██████
  ████▐▐████████████████
  ██▐▐██████████████████
  ████▐█████████████████
  ██████████████████████
  ████████████████▓▓████
  ██████████████▓▓██████
  █████████▒▒█████▓█████
  ███████▒▒█████████████
  █████████▒████████████
  ██████████████████████
  ██████████████████████
  ██████████████████████

Training 2:

Input:
  Shape: 24×24
  ████████████████████████
  ████████████████████████
  ████████████████████████
  ████████████████████████
  ██████░░░████████▀██████
  █████░███░███████▀▀█████
  ██████░█████████████████
  ██████░░████████████████
  ████████████████████████
  ████████████████████████
  ████████████████████████
  ██████████████████▌▌████
  ████████████████████▌███
  █████▐██████████████████
  ████▐███████████████████
  ████████████████████████
  ████████████████████████
  ████████████▒▒▒█████████
  ████████████████████████
  ████████████████████████
  ████████████████████████
  ████████████████████████
  ████████████████████████
  ████████████████████████

Output:
  Shape: 24×24
  ████████████████████████
  ████████████████████████
  █████████████████▀▀▀████
  ████████████████▀███▀███
  ██████░░░████████▀██████
  █████░███░███████▀▀█████
  ██████░█████████████████
  ██████░░████████████████
  ████████████████████████
  ████████████████████████
  ████████████████████████
  █████████████████▌▌▌████
  ████████████████▌███▌███
  █████▐▐▐█████████▌██████
  ████▐███▐████████▌▌█████
  █████▐██████████████████
  █████▐▐█████████████████
  ████████████▒▒▒█████████
  ███████████▒███▒████████
  ████████████▒███████████
  ████████████▒▒██████████
  ████████████████████████
  ████████████████████████
  ████████████████████████

--- SOLVING TASK ---

--- TEST CASE ---

Test Input:
  Shape: 30×30
  ██████████████████████████████
  ███████████████████████▐██████
  ██████████████████████▐███████
  ███████░█████▓████████▐███████
  ██████░█░███▓█████████████████
  █████░░█░██▓██████████████████
  ██████████████████████████████
  ██████████████████████████████
  ██████████████████████████████
  █████████████████████████▄████
  ████████████████████████▄▄████
  █████▀█████████▒██████████████
  █████▀█▀████████▒█████████████
  ████████████████▒█████████████
  ██████████████████████████████
  ██████████████████████████████
  ██████████████████████████████
  ██████████████████████████████
  ██████████████████████████████
  ███████████▌██████████████████
  ████████████▌█████████████████
  █████████████████████▓▓███████
  █████▆████████████████████████
  ███▆██████████████████████████
  ██████████████████████████████
  ██████████████████████████████
  ██████████████████████████████
  ██████████████████████████████
  ██████████████████████████████
  ██████████████████████████████

Expected Output:
  Shape: 30×30
  ██████████████████████████████
  ███████████████████████▐██████
  ██████████████████████▐█▐█████
  ███████░█████▓███████▐▐█▐█████
  ██████░█░███▓█▓███████████████
  █████░░█░██▓▓█▓███████████████
  ██████████████████████████████
  ██████████████████████████████
  ██████████████████████████▄███
  █████████████████████████▄█▄██
  ██████▀█████████████████▄▄█▄██
  █████▀█▀███████▒██████████████
  ████▀▀█▀██████▒█▒█████████████
  █████████████▒▒█▒█████████████
  ██████████████████████████████
  ██████████████████████████████
  ██████████████████████████████
  ██████████████████████████████
  ██████████████████████████████
  ███████████▌███████████▓██████
  ██████████▌█▌█████████▓█▓█████
  ████▆████▌▌█▌████████▓▓█▓█████
  ███▆█▆████████████████████████
  ██▆▆█▆████████████████████████
  ██████████████████████████████
  ██████████████████████████████
  ██████████████████████████████
  ██████████████████████████████
  ██████████████████████████████
  ██████████████████████████████

Predicted Output:
  Shape: 30×30
  ██████████████████████████████
  ███████████████████████▐██████
  ██████████████████████▐███████
  ███████░█████▓████████▐███████
  ██████░█░███▓█████████████████
  █████░░█░██▓██████████████████
  ██████████████████████████████
  ██████████████████████████████
  ██████████████████████████████
  █████████████████████████▄████
  ████████████████████████▄▄████
  █████▀█████████▒██████████████
  █████▀█▀████████▒█████████████
  ████████████████▒█████████████
  ██████████████████████████████
  ██████████████████████████████
  ██████████████████████████████
  ██████████████████████████████
  ██████████████████████████████
  ███████████▌██████████████████
  ████████████▌█████████████████
  █████████████████████▓▓███████
  █████▆████████████████████████
  ███▆██████████████████████████
  ██████████████████████████████
  ██████████████████████████████
  ██████████████████████████████
  ██████████████████████████████
  ██████████████████████████████
  ██████████████████████████████

Program used: {'schema': 'identity → color_remap', 'steps': [{'schema': 'identity', 'parameters': {}}, {'schema': 'color_remap', 'parameters': {'mapping': {np.int64(1): np.int64(1), np.int64(2): np.int64(2), np.int64(3): np.int64(3), np.int64(4): np.int64(4), np.int64(6): np.int64(6), np.int64(8): np.int64(8)}}}], 'probability': np.float64(0.970407196969697), 'complexity': 2.1}

--- ERROR ANALYSIS ---
Error type: minor_details
Description: Very close (97.0%), only 27 cells wrong
Accuracy: 97.00%

First few differences:
  Position (2, 24): predicted 1, expected 8
  Position (3, 21): predicted 1, expected 8
  Position (3, 24): predicted 1, expected 8
  Position (4, 14): predicted 1, expected 2
  Position (5, 12): predicted 1, expected 2


######################################################################
# TASK 2/5
######################################################################

======================================================================
ANALYZING TASK: 14754a24
======================================================================

Task ID: 14754a24
Training examples: 4
Test examples: 1

--- TRAINING EXAMPLES ---

Training 1:

Input:
  Shape: 18×19
  ·▄·▄▄·▄▄▄···▄··▄·▄·
  ···▄···▄▄▄····▄▄···
  ·▄▄···▄·▄▄····▄··▄·
  ··▄▄·▄▄··▄▄·▄·▄·▄··
  ··▄··░·▄·▄·▄···▄▄·▄
  ··▄·░▄░▄▄·▄···▄░▄▄▄
  ▄····░··▄▄····▄░░▄·
  ▄·▄▄▄▄·▄···▄·▄·░▄··
  ▄▄··▄·▄·▄▄·▄▄▄▄▄···
  ▄▄··▄▄▄·▄··▄··▄····
  ··▄▄····▄░▄·▄▄·····
  ▄▄▄░·▄·▄▄░░▄··▄▄▄▄·
  ··░▄··▄▄·░▄·▄··▄▄▄▄
  ····▄··▄····▄·▄··▄▄
  ▄▄·▄···▄▄▄▄▄·▄·····
  ▄▄···▄·······▄·▄··▄
  ▄·▄·▄▄·▄▄····▄▄····
  ·▄▄······▄▄▄▄▄·····

Output:
  Shape: 18×19
  ·▄·▄▄·▄▄▄···▄··▄·▄·
  ···▄···▄▄▄····▄▄···
  ·▄▄···▄·▄▄····▄··▄·
  ··▄▄·▄▄··▄▄·▄·▄·▄··
  ··▄··░·▄·▄·▄···▄▄·▄
  ··▄·░▓░▄▄·▄···▄░▄▄▄
  ▄····░··▄▄····▓░░▄·
  ▄·▄▄▄▄·▄···▄·▄·░▄··
  ▄▄··▄·▄·▄▄·▄▄▄▄▄···
  ▄▄··▄▄▄·▄··▄··▄····
  ··▓▄····▄░▄·▄▄·····
  ▄▓▓░·▄·▄▓░░▄··▄▄▄▄·
  ··░▄··▄▄·░▄·▄··▄▄▄▄
  ····▄··▄····▄·▄··▄▄
  ▄▄·▄···▄▄▄▄▄·▄·····
  ▄▄···▄·······▄·▄··▄
  ▄·▄·▄▄·▄▄····▄▄····
  ·▄▄······▄▄▄▄▄·····

Training 2:

Input:
  Shape: 18×16
  ·▄··▄▄···▄▄·▄··▄
  ▄▄····▄·▄··▄▄▄··
  ··░▄·▄·▄▄··░▄▄▄·
  ·▄▄░··▄··▄··░··▄
  ··░▄··▄·▄·····▄·
  ···▄·▄▄▄▄·▄·▄▄·▄
  ▄·▄··░▄░▄▄▄▄·▄··
  ····▄▄░▄▄······▄
  ··▄▄··▄·▄▄·▄▄░▄·
  ··▄··▄···▄▄·▄▄░▄
  ▄··░····▄····▄▄▄
  ▄▄░▄░▄·▄▄▄····▄▄
  ▄··▄▄▄·▄░▄░·▄···
  ▄··▄▄··▄·░···▄▄·
  ▄▄▄▄▄···▄▄▄·▄▄··
  ▄▄▄▄····▄·▄▄▄▄·▄
  ▄·▄·····▄·▄·▄▄··
  ▄····▄··▄▄▄▄···▄

Output:
  Shape: 18×16
  ·▄··▄▄···▄▄·▄··▄
  ▄▄····▄·▄··▄▓▄··
  ··░▄·▄·▄▄··░▓▓▄·
  ·▓▓░··▄··▄··░··▄
  ··░▄··▄·▄·····▄·
  ···▄·▄▓▄▄·▄·▄▄·▄
  ▄·▄··░▓░▄▄▄▄·▄··
  ····▄▄░▄▄······▄
  ··▄▄··▄·▄▄·▄▄░▄·
  ··▄··▄···▄▄·▓▓░▄
  ▄··░····▄····▓▄▄
  ▄▄░▓░▄·▄▄▓····▄▄
  ▄··▓▄▄·▄░▓░·▄···
  ▄··▄▄··▄·░···▄▄·
  ▄▄▄▄▄···▄▄▄·▄▄··
  ▄▄▄▄····▄·▄▄▄▄·▄
  ▄·▄·····▄·▄·▄▄··
  ▄····▄··▄▄▄▄···▄

--- SOLVING TASK ---

--- TEST CASE ---

Test Input:
  Shape: 19×19
  ··▄··▄▄·▄·▄·▄▄░▄··▄
  ·▄▄·▄░▄▄▄·▄▄·░▄·▄▄·
  ▄▄▄·▄▄░·▄▄·▄▄▄▄·▄·▄
  ▄▄░····▄···▄·▄···▄▄
  ▄░▄▄▄▄·▄··▄▄·▄▄·▄··
  ▄▄·▄···▄▄·▄░▄··▄·▄▄
  ·▄▄▄▄·▄▄▄▄░░▄·▄▄···
  ▄··▄▄▄▄····▄·▄▄··▄·
  ·▄·····▄··▄···▄·▄·▄
  ····▄··▄··▄··▄··▄▄·
  ····▄▄·▄·▄·▄·░···▄·
  ▄▄░▄▄▄▄▄··▄·░▄░·▄·▄
  ▄▄▄░···▄▄▄·▄▄░·▄▄▄▄
  ··░▄·····▄·▄·▄▄▄▄▄▄
  ▄·▄··▄·░▄··▄▄▄▄▄··▄
  ▄▄·▄▄·▄▄░··▄▄▄·▄·▄▄
  ▄▄▄·▄▄▄░·▄▄·▄▄··▄▄·
  ▄▄▄▄···▄··▄·▄·▄·▄··
  ·▄·▄▄▄··▄▄▄··▄▄▄▄▄▄

Expected Output:
  Shape: 19×19
  ··▄··▄▓·▄·▄·▓▓░▄··▄
  ·▄▄·▄░▓▓▄·▄▄·░▄·▄▄·
  ▄▓▄·▄▄░·▄▄·▄▄▄▄·▄·▄
  ▓▓░····▄···▄·▄···▄▄
  ▄░▄▄▄▄·▄··▄▄·▄▄·▄··
  ▄▄·▄···▄▄·▄░▄··▄·▄▄
  ·▄▄▄▄·▄▄▄▄░░▓·▄▄···
  ▄··▄▄▄▄····▓·▄▄··▄·
  ·▄·····▄··▄···▄·▄·▄
  ····▄··▄··▄··▄··▄▄·
  ····▄▄·▄·▄·▄·░···▄·
  ▄▄░▄▄▄▄▄··▄·░▓░·▄·▄
  ▄▓▓░···▄▄▄·▄▄░·▄▄▄▄
  ··░▄·····▄·▄·▄▄▄▄▄▄
  ▄·▄··▄·░▄··▄▄▄▄▄··▄
  ▄▄·▄▄·▓▓░··▄▄▄·▄·▄▄
  ▄▄▄·▄▄▄░·▄▄·▄▄··▄▄·
  ▄▄▄▄···▄··▄·▄·▄·▄··
  ·▄·▄▄▄··▄▄▄··▄▄▄▄▄▄

Predicted Output:
  Shape: 19×19
  ··▄··▄▄·▄·▄·▄▄░▄··▄
  ·▄▄·▄░▄▄▄·▄▄·░▄·▄▄·
  ▄▄▄·▄▄░·▄▄·▄▄▄▄·▄·▄
  ▄▄░····▄···▄·▄···▄▄
  ▄░▄▄▄▄·▄··▄▄·▄▄·▄··
  ▄▄·▄···▄▄·▄░▄··▄·▄▄
  ·▄▄▄▄·▄▄▄▄░░▄·▄▄···
  ▄··▄▄▄▄····▄·▄▄··▄·
  ·▄·····▄··▄···▄·▄·▄
  ····▄··▄··▄··▄··▄▄·
  ····▄▄·▄·▄·▄·░···▄·
  ▄▄░▄▄▄▄▄··▄·░▄░·▄·▄
  ▄▄▄░···▄▄▄·▄▄░·▄▄▄▄
  ··░▄·····▄·▄·▄▄▄▄▄▄
  ▄·▄··▄·░▄··▄▄▄▄▄··▄
  ▄▄·▄▄·▄▄░··▄▄▄·▄·▄▄
  ▄▄▄·▄▄▄░·▄▄·▄▄··▄▄·
  ▄▄▄▄···▄··▄·▄·▄·▄··
  ·▄·▄▄▄··▄▄▄··▄▄▄▄▄▄

Program used: {'schema': 'identity → erode', 'steps': [{'schema': 'identity', 'parameters': {}}, {'schema': 'erode', 'parameters': {'iterations': 1}}], 'probability': np.float64(0.960842209690894), 'complexity': 2.6}

--- ERROR ANALYSIS ---
Error type: minor_details
Description: Very close (95.8%), only 15 cells wrong
Accuracy: 95.84%

First few differences:
  Position (0, 6): predicted 5, expected 2
  Position (0, 12): predicted 5, expected 2
  Position (0, 13): predicted 5, expected 2
  Position (1, 6): predicted 5, expected 2
  Position (1, 7): predicted 5, expected 2


######################################################################
# TASK 3/5
######################################################################

======================================================================
ANALYZING TASK: 42918530
======================================================================

Task ID: 42918530
Training examples: 4
Test examples: 1

--- TRAINING EXAMPLES ---

Training 1:

Input:
  Shape: 13×19
  ···················
  ·▒▒▒▒▒·▐▐▐▐▐·░░░░░·
  ·▒···▒·▐···▐·░·░·░·
  ·▒···▒·▐···▐·░░░░░·
  ·▒···▒·▐···▐·░·░·░·
  ·▒▒▒▒▒·▐▐▐▐▐·░░░░░·
  ···················
  ·░░░░░·▓▓▓▓▓·▌▌▌▌▌·
  ·░···░·▓···▓·▌···▌·
  ·░···░·▓···▓·▌···▌·
  ·░···░·▓···▓·▌···▌·
  ·░░░░░·▓▓▓▓▓·▌▌▌▌▌·
  ···················

Output:
  Shape: 13×19
  ···················
  ·▒▒▒▒▒·▐▐▐▐▐·░░░░░·
  ·▒···▒·▐···▐·░·░·░·
  ·▒···▒·▐···▐·░░░░░·
  ·▒···▒·▐···▐·░·░·░·
  ·▒▒▒▒▒·▐▐▐▐▐·░░░░░·
  ···················
  ·░░░░░·▓▓▓▓▓·▌▌▌▌▌·
  ·░·░·░·▓···▓·▌···▌·
  ·░░░░░·▓···▓·▌···▌·
  ·░·░·░·▓···▓·▌···▌·
  ·░░░░░·▓▓▓▓▓·▌▌▌▌▌·
  ···················

Training 2:

Input:
  Shape: 19×19
  ···················
  ·▓▓▓▓▓·░░░░░·▐▐▐▐▐·
  ·▓·▓·▓·░···░·▐···▐·
  ·▓▓▓·▓·░···░·▐·▐·▐·
  ·▓···▓·░···░·▐···▐·
  ·▓▓▓▓▓·░░░░░·▐▐▐▐▐·
  ···················
  ·▐▐▐▐▐·▒▒▒▒▒·█████·
  ·▐···▐·▒···▒·█···█·
  ·▐···▐·▒·▒▒▒·█···█·
  ·▐···▐·▒·▒·▒·█···█·
  ·▐▐▐▐▐·▒▒▒▒▒·█████·
  ···················
  ·▓▓▓▓▓·█████·▓▓▓▓▓·
  ·▓···▓·█···█·▓···▓·
  ·▓···▓·█···█·▓···▓·
  ·▓···▓·█···█·▓···▓·
  ·▓▓▓▓▓·█████·▓▓▓▓▓·
  ···················

Output:
  Shape: 19×19
  ···················
  ·▓▓▓▓▓·░░░░░·▐▐▐▐▐·
  ·▓·▓·▓·░···░·▐···▐·
  ·▓▓▓·▓·░···░·▐·▐·▐·
  ·▓···▓·░···░·▐···▐·
  ·▓▓▓▓▓·░░░░░·▐▐▐▐▐·
  ···················
  ·▐▐▐▐▐·▒▒▒▒▒·█████·
  ·▐···▐·▒···▒·█···█·
  ·▐·▐·▐·▒·▒▒▒·█···█·
  ·▐···▐·▒·▒·▒·█···█·
  ·▐▐▐▐▐·▒▒▒▒▒·█████·
  ···················
  ·▓▓▓▓▓·█████·▓▓▓▓▓·
  ·▓·▓·▓·█···█·▓·▓·▓·
  ·▓▓▓·▓·█···█·▓▓▓·▓·
  ·▓···▓·█···█·▓···▓·
  ·▓▓▓▓▓·█████·▓▓▓▓▓·
  ···················

--- SOLVING TASK ---

--- TEST CASE ---

Test Input:
  Shape: 25×25
  ·························
  ·█████·▐▐▐▐▐·▒▒▒▒▒·▌▌▌▌▌·
  ·█···█·▐···▐·▒··▒▒·▌·▌·▌·
  ·█···█·▐▐▐·▐·▒·▒·▒·▌·▌·▌·
  ·█···█·▐·▐·▐·▒▒··▒·▌·▌·▌·
  ·█████·▐▐▐▐▐·▒▒▒▒▒·▌▌▌▌▌·
  ·························
  ·▀▀▀▀▀·▓▓▓▓▓·█████·▓▓▓▓▓·
  ·▀·▀·▀·▓·▓·▓·█···█·▓···▓·
  ·▀·▀▀▀·▓▓▓·▓·█···█·▓···▓·
  ·▀···▀·▓·▓·▓·█···█·▓···▓·
  ·▀▀▀▀▀·▓▓▓▓▓·█████·▓▓▓▓▓·
  ·························
  ·▐▐▐▐▐·░░░░░·▒▒▒▒▒·▓▓▓▓▓·
  ·▐···▐·░···░·▒···▒·▓···▓·
  ·▐···▐·░···░·▒···▒·▓···▓·
  ·▐···▐·░···░·▒···▒·▓···▓·
  ·▐▐▐▐▐·░░░░░·▒▒▒▒▒·▓▓▓▓▓·
  ·························
  ·▓▓▓▓▓·▐▐▐▐▐·▓▓▓▓▓·▀▀▀▀▀·
  ·▓···▓·▐···▐·▓···▓·▀···▀·
  ·▓···▓·▐···▐·▓···▓·▀···▀·
  ·▓···▓·▐···▐·▓···▓·▀···▀·
  ·▓▓▓▓▓·▐▐▐▐▐·▓▓▓▓▓·▀▀▀▀▀·
  ·························

Expected Output:
  Shape: 25×25
  ·························
  ·█████·▐▐▐▐▐·▒▒▒▒▒·▌▌▌▌▌·
  ·█···█·▐···▐·▒··▒▒·▌·▌·▌·
  ·█···█·▐▐▐·▐·▒·▒·▒·▌·▌·▌·
  ·█···█·▐·▐·▐·▒▒··▒·▌·▌·▌·
  ·█████·▐▐▐▐▐·▒▒▒▒▒·▌▌▌▌▌·
  ·························
  ·▀▀▀▀▀·▓▓▓▓▓·█████·▓▓▓▓▓·
  ·▀·▀·▀·▓·▓·▓·█···█·▓·▓·▓·
  ·▀·▀▀▀·▓▓▓·▓·█···█·▓▓▓·▓·
  ·▀···▀·▓·▓·▓·█···█·▓·▓·▓·
  ·▀▀▀▀▀·▓▓▓▓▓·█████·▓▓▓▓▓·
  ·························
  ·▐▐▐▐▐·░░░░░·▒▒▒▒▒·▓▓▓▓▓·
  ·▐···▐·░···░·▒··▒▒·▓·▓·▓·
  ·▐▐▐·▐·░···░·▒·▒·▒·▓▓▓·▓·
  ·▐·▐·▐·░···░·▒▒··▒·▓·▓·▓·
  ·▐▐▐▐▐·░░░░░·▒▒▒▒▒·▓▓▓▓▓·
  ·························
  ·▓▓▓▓▓·▐▐▐▐▐·▓▓▓▓▓·▀▀▀▀▀·
  ·▓·▓·▓·▐···▐·▓·▓·▓·▀·▀·▀·
  ·▓▓▓·▓·▐▐▐·▐·▓▓▓·▓·▀·▀▀▀·
  ·▓·▓·▓·▐·▐·▐·▓·▓·▓·▀···▀·
  ·▓▓▓▓▓·▐▐▐▐▐·▓▓▓▓▓·▀▀▀▀▀·
  ·························

Predicted Output:
  Shape: 25×25
  ·························
  ·█████·▐▐▐▐▐·▒▒▒▒▒·▌▌▌▌▌·
  ·█···█·▐···▐·▒··▒▒·▌·▌·▌·
  ·█···█·▐▐▐·▐·▒·▒·▒·▌·▌·▌·
  ·█···█·▐·▐·▐·▒▒··▒·▌·▌·▌·
  ·█████·▐▐▐▐▐·▒▒▒▒▒·▌▌▌▌▌·
  ·························
  ·▀▀▀▀▀·▓▓▓▓▓·█████·▓▓▓▓▓·
  ·▀·▀·▀·▓·▓·▓·█···█·▓···▓·
  ·▀·▀▀▀·▓▓▓·▓·█···█·▓···▓·
  ·▀···▀·▓·▓·▓·█···█·▓···▓·
  ·▀▀▀▀▀·▓▓▓▓▓·█████·▓▓▓▓▓·
  ·························
  ·▐▐▐▐▐·░░░░░·▒▒▒▒▒·▓▓▓▓▓·
  ·▐···▐·░···░·▒···▒·▓···▓·
  ·▐···▐·░···░·▒···▒·▓···▓·
  ·▐···▐·░···░·▒···▒·▓···▓·
  ·▐▐▐▐▐·░░░░░·▒▒▒▒▒·▓▓▓▓▓·
  ·························
  ·▓▓▓▓▓·▐▐▐▐▐·▓▓▓▓▓·▀▀▀▀▀·
  ·▓···▓·▐···▐·▓···▓·▀···▀·
  ·▓···▓·▐···▐·▓···▓·▀···▀·
  ·▓···▓·▐···▐·▓···▓·▀···▀·
  ·▓▓▓▓▓·▐▐▐▐▐·▓▓▓▓▓·▀▀▀▀▀·
  ·························

Program used: {'schema': 'identity → color_remap', 'steps': [{'schema': 'identity', 'parameters': {}}, {'schema': 'color_remap', 'parameters': {'mapping': {np.int64(0): np.int64(0), np.int64(2): np.int64(2), np.int64(3): np.int64(3), np.int64(4): np.int64(4), np.int64(7): np.int64(7), np.int64(8): np.int64(8)}}}], 'probability': np.float64(0.9693714042190498), 'complexity': 2.1}

--- ERROR ANALYSIS ---
Error type: minor_details
Description: Very close (95.5%), only 28 cells wrong
Accuracy: 95.52%

First few differences:
  Position (8, 21): predicted 0, expected 2
  Position (9, 20): predicted 0, expected 2
  Position (9, 21): predicted 0, expected 2
  Position (10, 21): predicted 0, expected 2
  Position (14, 16): predicted 0, expected 3


######################################################################
# TASK 4/5
######################################################################

======================================================================
ANALYZING TASK: 575b1a71
======================================================================

Task ID: 575b1a71
Training examples: 3
Test examples: 1

--- TRAINING EXAMPLES ---

Training 1:

Input:
  Shape: 10×10
  ▄▄▄▄▄·▄▄▄▄
  ▄▄▄▄▄▄▄▄▄▄
  ▄▄▄▄▄▄▄▄▄▄
  ▄·▄▄▄·▄▄▄▄
  ▄▄▄▄··▄▄▄▄
  ▄·▄▄·▄▄▄▄▄
  ▄·▄▄·▄▄▄▄▄
  ▄▄▄▄▄▄▄▄·▄
  ▄·▄▄··▄▄·▄
  ▄▄▄▄▄▄▄▄·▄

Output:
  Shape: 10×10
  ▄▄▄▄▄▒▄▄▄▄
  ▄▄▄▄▄▄▄▄▄▄
  ▄▄▄▄▄▄▄▄▄▄
  ▄█▄▄▄▒▄▄▄▄
  ▄▄▄▄▓▒▄▄▄▄
  ▄█▄▄▓▄▄▄▄▄
  ▄█▄▄▓▄▄▄▄▄
  ▄▄▄▄▄▄▄▄░▄
  ▄█▄▄▓▒▄▄░▄
  ▄▄▄▄▄▄▄▄░▄

Training 2:

Input:
  Shape: 10×10
  ·▄▄▄▄▄▄·▄▄
  ▄▄▄▄▄▄▄▄▄▄
  ▄▄▄▄·▄▄▄▄▄
  ▄▄▄▄▄▄▄·▄▄
  ▄▄▄▄·▄▄▄▄▄
  ▄▄▄▄▄▄▄▄▄▄
  ▄▄▄▄▄▄▄▄▄▄
  ▄▄▄▄·▄▄▄▄▄
  ▄▄▄▄▄▄▄▄·▄
  ▄▄▄▄·▄▄▄▄▄

Output:
  Shape: 10×10
  █▄▄▄▄▄▄▒▄▄
  ▄▄▄▄▄▄▄▄▄▄
  ▄▄▄▄▓▄▄▄▄▄
  ▄▄▄▄▄▄▄▒▄▄
  ▄▄▄▄▓▄▄▄▄▄
  ▄▄▄▄▄▄▄▄▄▄
  ▄▄▄▄▄▄▄▄▄▄
  ▄▄▄▄▓▄▄▄▄▄
  ▄▄▄▄▄▄▄▄░▄
  ▄▄▄▄▓▄▄▄▄▄

--- SOLVING TASK ---

--- TEST CASE ---

Test Input:
  Shape: 10×10
  ▄▄▄·▄▄▄▄▄▄
  ▄▄▄▄▄▄▄▄▄▄
  ▄▄▄▄▄▄▄▄▄▄
  ·▄▄▄▄▄▄▄▄▄
  ▄▄▄▄▄·▄▄▄▄
  ▄▄·▄▄▄▄▄▄▄
  ▄▄·▄▄▄▄▄▄▄
  ·▄▄▄▄▄▄▄▄▄
  ▄▄▄▄▄▄▄▄▄▄
  ·▄▄▄▄·▄▄▄▄

Expected Output:
  Shape: 10×10
  ▄▄▄▒▄▄▄▄▄▄
  ▄▄▄▄▄▄▄▄▄▄
  ▄▄▄▄▄▄▄▄▄▄
  █▄▄▄▄▄▄▄▄▄
  ▄▄▄▄▄░▄▄▄▄
  ▄▄▓▄▄▄▄▄▄▄
  ▄▄▓▄▄▄▄▄▄▄
  █▄▄▄▄▄▄▄▄▄
  ▄▄▄▄▄▄▄▄▄▄
  █▄▄▄▄░▄▄▄▄

Predicted Output:
  Shape: 10×10
  ▄▄▄░▄▄▄▄▄▄
  ▄▄▄▄▄▄▄▄▄▄
  ▄▄▄▄▄▄▄▄▄▄
  ░▄▄▄▄▄▄▄▄▄
  ▄▄▄▄▄▓▄▄▄▄
  ▄▄▓▄▄▄▄▄▄▄
  ▄▄▓▄▄▄▄▄▄▄
  ░▄▄▄▄▄▄▄▄▄
  ▄▄▄▄▄▄▄▄▄▄
  ░▄▄▄▄░▄▄▄▄

Program used: {'schema': 'fill_enclosed → color_remap', 'steps': [{'schema': 'fill_enclosed', 'parameters': {'fill_color': 2}}, {'schema': 'color_remap', 'parameters': {'mapping': {0: 4}}}], 'probability': np.float64(0.9466666666666667), 'complexity': 4.0}

--- ERROR ANALYSIS ---
Error type: small_details
Description: Small details wrong (95.0%), 5 cells differ
Accuracy: 95.00%

First few differences:
  Position (0, 3): predicted 4, expected 3
  Position (3, 0): predicted 4, expected 1
  Position (4, 5): predicted 2, expected 4
  Position (7, 0): predicted 4, expected 1
  Position (9, 0): predicted 4, expected 1


######################################################################
# TASK 5/5
######################################################################

======================================================================
ANALYZING TASK: e681b708
======================================================================

Task ID: e681b708
Training examples: 3
Test examples: 1

--- TRAINING EXAMPLES ---

Training 1:

Input:
  Shape: 27×23
  ··█··█····▓··█·····█···
  ···█···█··█·····█····█·
  ··········█············
  ▀█████████▓███████████▒
  ··········█············
  ··█··█····█············
  ··········█············
  ····█···█·█····█···█···
  ··········█············
  ▐█████████▓············
  ··········█············
  ··········█···█···█····
  ··█···█···█············
  ····█·····█············
  ·······█··█············
  ··········█············
  ▒█████████▒██████▒████▒
  ··········█······█·····
  ··········█······█·····
  ··········█··█···█·█···
  ·█····█···█····█·█···█·
  ···█······█······█·····
  ··········█·█····█·····
  ··········█······█·····
  ··█·······█···█··█··█··
  ··········█······█····█
  ··········▓······▐·····

Output:
  Shape: 27×23
  ··▓··▓····▓··▓·····▓···
  ···▓···▓··█·····▓····▓·
  ··········█············
  ▀█████████▓███████████▒
  ··········█············
  ··▓··▓····█············
  ··········█············
  ····▓···▓·█····▒···▒···
  ··········█············
  ▐█████████▓············
  ··········█············
  ··········█···▒···▒····
  ··▒···▒···█············
  ····▒·····█············
  ·······▒··█············
  ··········█············
  ▒█████████▒██████▒████▒
  ··········█······█·····
  ··········█······█·····
  ··········█··▒···█·▒···
  ·▒····▒···█····▒·█···▒·
  ···▒······█······█·····
  ··········█·▒····█·····
  ··········█······█·····
  ··▒·······█···▒··█··▒··
  ··········█······█····▒
  ··········▓······▐·····

Training 2:

Input:
  Shape: 22×24
  ·······▓················
  ··█····█····█·········█·
  ·······█················
  ··█·█··█··█·····█·······
  ·······█················
  ▒██████▓████████▓██████▒
  ·······█········█·······
  ·······█········█·······
  ·······█··█···█·█···█··█
  ·█·····█········█·······
  ·····█·█·····█··█··█··█·
  ·······█········█·······
  ·······█········█·······
  ·······▒████████▐██████▐
  ···█···█········█·······
  ·······█··█·····█······█
  ·······█········█··█····
  ···█···█····█···█····█··
  ·······█········█·······
  ·█·····█········█·······
  ·······█····█···█···█···
  ·······▒········▒·······

Output:
  Shape: 22×24
  ·······▓················
  ··▓····█····▓·········▓·
  ·······█················
  ··▓·▓··█··▓·····▓·······
  ·······█················
  ▒██████▓████████▓██████▒
  ·······█········█·······
  ·······█········█·······
  ·······█··▓···▓·█···▐··▐
  ·▒·····█········█·······
  ·····▒·█·····▓··█··▐··▐·
  ·······█········█·······
  ·······█········█·······
  ·······▒████████▐██████▐
  ···▒···█········█·······
  ·······█··▒·····█······▐
  ·······█········█··▐····
  ···▒···█····▒···█····▐··
  ·······█········█·······
  ·▒·····█········█·······
  ·······█····▒···█···▐···
  ·······▒········▒·······

--- SOLVING TASK ---

--- TEST CASE ---

Test Input:
  Shape: 26×26
  ·······▒··········▐··█···█
  ·····█·█··█·····█·█·······
  ··█····█······█···█····█··
  ·······█··········█·······
  ▓██████▓█████▒████▒██████▐
  ·······█·····█····█·······
  ·······█·█···█·█··█···█···
  ··█····█···█·█··█·█·······
  ····█··█·····█····█·····█·
  ·······█·█···█·█··█··█····
  ·······█·····█····█·······
  ·█·····█·····█····█·······
  ·······░█████▓████░██████░
  ·······█··········█·······
  ··█·█··█··········█·█·····
  ·······█····█·····█····█··
  ·······█··········█·······
  ·······█··········█·······
  ·······█··········█·█··█··
  ▒██████▓··█·······█·······
  ·······█·······█··█·······
  ·······█··········▒██████░
  █··█···█··········█·······
  ·······█·····█····█·······
  ····█··█··········█···█·█·
  ·······▒··········░·······

Expected Output:
  Shape: 26×26
  ·······▒··········▐··▐···▐
  ·····▓·█··▒·····▒·█·······
  ··▓····█······▒···█····▐··
  ·······█··········█·······
  ▓██████▓█████▒████▒██████▐
  ·······█·····█····█·······
  ·······█·▓···█·▒··█···░···
  ··▓····█···▓·█··▒·█·······
  ····▓··█·····█····█·····░·
  ·······█·▓···█·▒··█··░····
  ·······█·····█····█·······
  ·▓·····█·····█····█·······
  ·······░█████▓████░██████░
  ·······█··········█·······
  ··▓·▓··█··········█·░·····
  ·······█····░·····█····░··
  ·······█··········█·······
  ·······█··········█·······
  ·······█··········█·░··░··
  ▒██████▓··░·······█·······
  ·······█·······░··█·······
  ·······█··········▒██████░
  ▒··▒···█··········█·······
  ·······█·····░····█·······
  ····▒··█··········█···░·░·
  ·······▒··········░·······

Predicted Output:
  Shape: 26×26
  ·······▒··········▐··█···█
  ·····█·█··█·····█·█·······
  ··█····█······█···█····█··
  ·······█··········█·······
  ▓██████▓█████▒████▒██████▐
  ·······█·····█····█·······
  ·······█·█···█·█··█···█···
  ··█····█···█·█··█·█·······
  ····█··█·····█····█·····█·
  ·······█·█···█·█··█··█····
  ·······█·····█····█·······
  ·█·····█·····█····█·······
  ·······░█████▓████░██████░
  ·······█··········█·······
  ··█·█··█··········█·█·····
  ·······█····█·····█····█··
  ·······█··········█·······
  ·······█··········█·······
  ·······█··········█·█··█··
  ▒██████▓··█·······█·······
  ·······█·······█··█·······
  ·······█··········▒██████░
  █··█···█··········█·······
  ·······█·····█····█·······
  ····█··█··········█···█·█·
  ·······▒··········░·······

Program used: {'schema': 'identity → color_remap', 'steps': [{'schema': 'identity', 'parameters': {}}, {'schema': 'color_remap', 'parameters': {'mapping': {np.int64(0): np.int64(0), np.int64(1): np.int64(1), np.int64(2): np.int64(2), np.int64(3): np.int64(3), np.int64(6): np.int64(6), np.int64(8): np.int64(8)}}}], 'probability': np.float64(0.9512577465476016), 'complexity': 2.1}

--- ERROR ANALYSIS ---
Error type: small_details
Description: Small details wrong (94.8%), 35 cells differ
Accuracy: 94.82%

First few differences:
  Position (0, 21): predicted 1, expected 8
  Position (0, 25): predicted 1, expected 8
  Position (1, 5): predicted 1, expected 2
  Position (1, 10): predicted 1, expected 3
  Position (1, 16): predicted 1, expected 3


======================================================================
SUMMARY OF FINDINGS
======================================================================

Error type distribution:
  minor_details       : 3 tasks - fd096ab6, 14754a24, 42918530
  small_details       : 2 tasks - 575b1a71, e681b708
